{
  "version": "1.0",
  "case_id": "am-rev",
  "document_id": "am-rev-washington-orders-1776-02-09",
  "source_language": "en",
  "generated_at": "2026-06-17T01:08:21",
  "status": "worklist",
  "meta": {
    "title": "General Orders, 9 February 1776",
    "short_title": "Orders: Winter Encampment",
    "register": "military-general-orders",
    "date": "1776-02-09",
    "source_url": "https://founders.archives.gov/documents/Washington/03-06-02-0138",
    "annotation_language_policy": "source-language"
  },
  "lexical_units": [
    {
      "mipvu_id": "am-rev-washington-orders-1776-02-09_s01_p01_s01_lu001",
      "case_id": "am-rev",
      "document_id": "am-rev-washington-orders-1776-02-09",
      "sentence_id": "am-rev-washington-orders-1776-02-09_s01_p01_s01",
      "lexical_unit": "General",
      "lemma": "general",
      "language": "en",
      "unit_ordinal": 1,
      "sentence_unit_ordinal": 1,
      "char_offset_start": 0,
      "char_offset_end": 7,
      "sentence_char_offset_start": 0,
      "sentence_char_offset_end": 7,
      "review_status": "pending"
    },
    {
      "mipvu_id": "am-rev-washington-orders-1776-02-09_s01_p01_s01_lu002",
      "case_id": "am-rev",
      "document_id": "am-rev-washington-orders-1776-02-09",
      "sentence_id": "am-rev-washington-orders-1776-02-09_s01_p01_s01",
      "lexical_unit": "Orders",
      "lemma": "orders",
      "language": "en",
      "unit_ordinal": 2,
      "sentence_unit_ordinal": 2,
      "char_offset_start": 8,
      "char_offset_end": 14,
      "sentence_char_offset_start": 8,
      "sentence_char_offset_end": 14,
      "review_status": "pending"
    },
    {
      "mipvu_id": "am-rev-washington-orders-1776-02-09_s01_p01_s01_lu003",
      "case_id": "am-rev",
      "document_id": "am-rev-washington-orders-1776-02-09",
      "sentence_id": "am-rev-washington-orders-1776-02-09_s01_p01_s01",
      "lexical_unit": "9",
      "lemma": "9",
      "language": "en",
      "unit_ordinal": 3,
      "sentence_unit_ordinal": 3,
      "char_offset_start": 16,
      "char_offset_end": 17,
      "sentence_char_offset_start": 16,
      "sentence_char_offset_end": 17,
      "review_status": "pending"
    },
    {
      "mipvu_id": "am-rev-washington-orders-1776-02-09_s01_p01_s01_lu004",
      "case_id": "am-rev",
      "document_id": "am-rev-washington-orders-1776-02-09",
      "sentence_id": "am-rev-washington-orders-1776-02-09_s01_p01_s01",
      "lexical_unit": "February",
      "lemma": "february",
      "language": "en",
      "unit_ordinal": 4,
      "sentence_unit_ordinal": 4,
      "char_offset_start": 18,
      "char_offset_end": 26,
      "sentence_char_offset_start": 18,
      "sentence_char_offset_end": 26,
      "review_status": "pending"
    },
    {
      "mipvu_id": "am-rev-washington-orders-1776-02-09_s01_p01_s01_lu005",
      "case_id": "am-rev",
      "document_id": "am-rev-washington-orders-1776-02-09",
      "sentence_id": "am-rev-washington-orders-1776-02-09_s01_p01_s01",
      "lexical_unit": "1776",
      "lemma": "1776",
      "language": "en",
      "unit_ordinal": 5,
      "sentence_unit_ordinal": 5,
      "char_offset_start": 27,
      "char_offset_end": 31,
      "sentence_char_offset_start": 27,
      "sentence_char_offset_end": 31,
      "review_status": "pending"
    },
    {
      "mipvu_id": "am-rev-washington-orders-1776-02-09_s01_p01_s01_lu006",
      "case_id": "am-rev",
      "document_id": "am-rev-washington-orders-1776-02-09",
      "sentence_id": "am-rev-washington-orders-1776-02-09_s01_p01_s01",
      "lexical_unit": "General",
      "lemma": "general",
      "language": "en",
      "unit_ordinal": 6,
      "sentence_unit_ordinal": 6,
      "char_offset_start": 32,
      "char_offset_end": 39,
      "sentence_char_offset_start": 32,
      "sentence_char_offset_end": 39,
      "review_status": "pending"
    },
    {
      "mipvu_id": "am-rev-washington-orders-1776-02-09_s01_p01_s01_lu007",
      "case_id": "am-rev",
      "document_id": "am-rev-washington-orders-1776-02-09",
      "sentence_id": "am-rev-washington-orders-1776-02-09_s01_p01_s01",
      "lexical_unit": "Orders",
      "lemma": "orders",
      "language": "en",
      "unit_ordinal": 7,
      "sentence_unit_ordinal": 7,
      "char_offset_start": 40,
      "char_offset_end": 46,
      "sentence_char_offset_start": 40,
      "sentence_char_offset_end": 46,
      "review_status": "pending"
    },
    {
      "mipvu_id": "am-rev-washington-orders-1776-02-09_s01_p02_s01_lu001",
      "case_id": "am-rev",
      "document_id": "am-rev-washington-orders-1776-02-09",
      "sentence_id": "am-rev-washington-orders-1776-02-09_s01_p02_s01",
      "lexical_unit": "Head",
      "lemma": "head",
      "language": "en",
      "unit_ordinal": 8,
      "sentence_unit_ordinal": 1,
      "char_offset_start": 48,
      "char_offset_end": 52,
      "sentence_char_offset_start": 0,
      "sentence_char_offset_end": 4,
      "review_status": "pending"
    },
    {
      "mipvu_id": "am-rev-washington-orders-1776-02-09_s01_p02_s01_lu002",
      "case_id": "am-rev",
      "document_id": "am-rev-washington-orders-1776-02-09",
      "sentence_id": "am-rev-washington-orders-1776-02-09_s01_p02_s01",
      "lexical_unit": "Quarters",
      "lemma": "quarters",
      "language": "en",
      "unit_ordinal": 9,
      "sentence_unit_ordinal": 2,
      "char_offset_start": 53,
      "char_offset_end": 61,
      "sentence_char_offset_start": 5,
      "sentence_char_offset_end": 13,
      "review_status": "pending"
    },
    {
      "mipvu_id": "am-rev-washington-orders-1776-02-09_s01_p02_s01_lu003",
      "case_id": "am-rev",
      "document_id": "am-rev-washington-orders-1776-02-09",
      "sentence_id": "am-rev-washington-orders-1776-02-09_s01_p02_s01",
      "lexical_unit": "Cambridge",
      "lemma": "cambridge",
      "language": "en",
      "unit_ordinal": 10,
      "sentence_unit_ordinal": 3,
      "char_offset_start": 63,
      "char_offset_end": 72,
      "sentence_char_offset_start": 15,
      "sentence_char_offset_end": 24,
      "review_status": "pending"
    },
    {
      "mipvu_id": "am-rev-washington-orders-1776-02-09_s01_p02_s01_lu004",
      "case_id": "am-rev",
      "document_id": "am-rev-washington-orders-1776-02-09",
      "sentence_id": "am-rev-washington-orders-1776-02-09_s01_p02_s01",
      "lexical_unit": "Feby",
      "lemma": "feby",
      "language": "en",
      "unit_ordinal": 11,
      "sentence_unit_ordinal": 4,
      "char_offset_start": 74,
      "char_offset_end": 78,
      "sentence_char_offset_start": 26,
      "sentence_char_offset_end": 30,
      "review_status": "pending"
    },
    {
      "mipvu_id": "am-rev-washington-orders-1776-02-09_s01_p02_s01_lu005",
      "case_id": "am-rev",
      "document_id": "am-rev-washington-orders-1776-02-09",
      "sentence_id": "am-rev-washington-orders-1776-02-09_s01_p02_s01",
      "lexical_unit": "9th",
      "lemma": "9th",
      "language": "en",
      "unit_ordinal": 12,
      "sentence_unit_ordinal": 5,
      "char_offset_start": 79,
      "char_offset_end": 82,
      "sentence_char_offset_start": 31,
      "sentence_char_offset_end": 34,
      "review_status": "pending"
    },
    {
      "mipvu_id": "am-rev-washington-orders-1776-02-09_s01_p02_s01_lu006",
      "case_id": "am-rev",
      "document_id": "am-rev-washington-orders-1776-02-09",
      "sentence_id": "am-rev-washington-orders-1776-02-09_s01_p02_s01",
      "lexical_unit": "1776",
      "lemma": "1776",
      "language": "en",
      "unit_ordinal": 13,
      "sentence_unit_ordinal": 6,
      "char_offset_start": 83,
      "char_offset_end": 87,
      "sentence_char_offset_start": 35,
      "sentence_char_offset_end": 39,
      "review_status": "pending"
    },
    {
      "mipvu_id": "am-rev-washington-orders-1776-02-09_s01_p03_s01_lu001",
      "case_id": "am-rev",
      "document_id": "am-rev-washington-orders-1776-02-09",
      "sentence_id": "am-rev-washington-orders-1776-02-09_s01_p03_s01",
      "lexical_unit": "Parole",
      "lemma": "parole",
      "language": "en",
      "unit_ordinal": 14,
      "sentence_unit_ordinal": 1,
      "char_offset_start": 87,
      "char_offset_end": 93,
      "sentence_char_offset_start": 0,
      "sentence_char_offset_end": 6,
      "review_status": "pending"
    },
    {
      "mipvu_id": "am-rev-washington-orders-1776-02-09_s01_p03_s01_lu002",
      "case_id": "am-rev",
      "document_id": "am-rev-washington-orders-1776-02-09",
      "sentence_id": "am-rev-washington-orders-1776-02-09_s01_p03_s01",
      "lexical_unit": "Stirling",
      "lemma": "stirling",
      "language": "en",
      "unit_ordinal": 15,
      "sentence_unit_ordinal": 2,
      "char_offset_start": 94,
      "char_offset_end": 102,
      "sentence_char_offset_start": 7,
      "sentence_char_offset_end": 15,
      "review_status": "pending"
    },
    {
      "mipvu_id": "am-rev-washington-orders-1776-02-09_s01_p03_s01_lu003",
      "case_id": "am-rev",
      "document_id": "am-rev-washington-orders-1776-02-09",
      "sentence_id": "am-rev-washington-orders-1776-02-09_s01_p03_s01",
      "lexical_unit": "Countersign",
      "lemma": "countersign",
      "language": "en",
      "unit_ordinal": 16,
      "sentence_unit_ordinal": 3,
      "char_offset_start": 103,
      "char_offset_end": 114,
      "sentence_char_offset_start": 16,
      "sentence_char_offset_end": 27,
      "review_status": "pending"
    },
    {
      "mipvu_id": "am-rev-washington-orders-1776-02-09_s01_p03_s01_lu004",
      "case_id": "am-rev",
      "document_id": "am-rev-washington-orders-1776-02-09",
      "sentence_id": "am-rev-washington-orders-1776-02-09_s01_p03_s01",
      "lexical_unit": "Jersey",
      "lemma": "jersey",
      "language": "en",
      "unit_ordinal": 17,
      "sentence_unit_ordinal": 4,
      "char_offset_start": 115,
      "char_offset_end": 121,
      "sentence_char_offset_start": 28,
      "sentence_char_offset_end": 34,